{
  "schemaVersion": "provider-eligibility-schema.v1",
  "providerPolicyVersion": "provider-eligibility.v1",
  "defaultProvider": "LOCAL",
  "cloudDefault": "DENY",
  "fallback": "PROHIBITED",
  "allowRules": [
    {
      "id": "LOCAL_APPROVED_CONTEXT",
      "provider": "LOCAL",
      "models": ["local-approved-model"],
      "accessClasses": ["ANONYMOUS_SESSION", "STUDENT", "INSTRUCTOR", "OPERATOR"],
      "workflows": ["COURSE_QA", "CONCEPT_REVIEW", "EXAM_PRACTICE", "CODING_COACH", "ASSIGNMENT_VERIFICATION", "FACULTY_AUTHORING", "FEEDBACK_REPORT"],
      "learningModes": ["DIRECT_EXPLANATION", "SOCRATIC", "PRACTICE", "VERIFICATION", "AUTHORING"],
      "inputTypes": ["TEXT", "KNOWLEDGE_REFERENCE", "UPLOAD_REFERENCE", "DETERMINISTIC_EVIDENCE_REFERENCE", "AUDIO_REFERENCE"],
      "dataClasses": ["APPROVED_PUBLIC_COURSE_KNOWLEDGE", "APPROVED_PRIVATE_COURSE_MATERIAL", "IDENTITY_FREE_USER_TEXT", "IDENTITY_MINIMIZED_USER_TEXT", "PRIVACY_SENSITIVE_STUDENT_CONTENT", "TEMPORARY_UPLOAD", "ASSIGNMENT_ARTIFACT", "DERIVED_VERIFIER_EVIDENCE", "INSTRUCTOR_ONLY_SOLUTION_MATERIAL", "FEEDBACK_REPORT_CONTENT", "TEMPORARY_SPEECH_AUDIO"],
      "artifactStates": ["NONE", "MINIMIZED_DERIVATION", "TEMPORARY_UPLOAD", "ASSIGNMENT_ARTIFACT"],
      "requireFeatureEnabled": true,
      "requireScheduleOpen": true,
      "requireWithinBudget": true,
      "requireQuotaAvailable": true,
      "activeAssessment": "ALLOW"
    },
    {
      "id": "OPENAI_IDENTITY_FREE_TEXT",
      "provider": "OPENAI",
      "models": ["cloud-approved-model"],
      "accessClasses": ["ANONYMOUS_SESSION", "STUDENT", "INSTRUCTOR"],
      "workflows": ["COURSE_QA", "CONCEPT_REVIEW", "CODING_COACH", "FACULTY_AUTHORING"],
      "learningModes": ["DIRECT_EXPLANATION", "SOCRATIC", "PRACTICE", "AUTHORING"],
      "inputTypes": ["TEXT"],
      "dataClasses": ["IDENTITY_FREE_USER_TEXT"],
      "artifactStates": ["NONE", "MINIMIZED_DERIVATION"],
      "requireFeatureEnabled": true,
      "requireScheduleOpen": true,
      "requireWithinBudget": true,
      "requireQuotaAvailable": true,
      "activeAssessment": "DENY"
    },
    {
      "id": "OPENAI_PUBLIC_KNOWLEDGE",
      "provider": "OPENAI",
      "models": ["cloud-approved-model"],
      "accessClasses": ["ANONYMOUS_SESSION", "STUDENT", "INSTRUCTOR"],
      "workflows": ["COURSE_QA", "CONCEPT_REVIEW", "CODING_COACH", "FACULTY_AUTHORING"],
      "learningModes": ["DIRECT_EXPLANATION", "SOCRATIC", "PRACTICE", "AUTHORING"],
      "inputTypes": ["KNOWLEDGE_REFERENCE"],
      "dataClasses": ["APPROVED_PUBLIC_COURSE_KNOWLEDGE"],
      "artifactStates": ["NONE", "MINIMIZED_DERIVATION"],
      "requireFeatureEnabled": true,
      "requireScheduleOpen": true,
      "requireWithinBudget": true,
      "requireQuotaAvailable": true,
      "activeAssessment": "DENY"
    }
  ],
  "denyReasonPrecedence": ["POLICY_VERSION_MISMATCH", "CLIENT_POLICY_OVERRIDE", "UNKNOWN_DATA_CLASS", "PROVIDER_PROCESSING_PROHIBITED", "LOCAL_ONLY_DATA", "PROVIDER_DISABLED", "SCHEDULE_CLOSED", "ACTIVE_ASSESSMENT", "OVER_BUDGET", "QUOTA_UNAVAILABLE", "MODEL_NOT_ALLOWED", "CLOUD_NOT_EXPLICITLY_ALLOWED", "CONTEXT_NOT_ALLOWED"]
}
